question_id,subject_id,topic_id,linked_question_id,question_text,question_type,context,total_marks
5.7,aqa_biology_foundation,,,"Calculate the mean number of bacteria per mm' of milk in the samples. Complete the following steps.
Calculate the total area of the counting chamber in Figure 10.
____
The depth of the counting chamber is 0.01 mm
Calculate the volume of the counting chamber in Figure 10.
Use the equation:
volume = area x depth
____
Calculate the mean number of bacteria per mm' of milk ni the samples. Use the equation:
mean number of bacteria per mm of milk = mean number of bacteria from Question 056/volume of counting chamber.
____",bio_fill_in_blank,,3
5.8,aqa_biology_foundation,,,"Which of the milk samples could not be sold for humans to drink?
A: P
B: Q
C: R
D: S",bio_mc,,1
5.9,aqa_biology_foundation,,,Why should milk sold for humans to drink not contain large numbers of bacteria?,bio_any_n_from_approximate,,1
6.1,aqa_biology_foundation,,,Which organ system is the heart a part of?,bio_any_n_from_exact,,1
6.2,aqa_biology_foundation,,,Draw a ring around one valve on Figure 1.,bio_draw_diagram,,1
6.3,aqa_biology_foundation,,,What is the function of the valves in the heart?,bio_any_n_from_approximate,,1
6.4,aqa_biology_foundation,,,"
Valves are also found inside some blood vessels. Which type of blood vessel contains valves?",bio_any_n_from_exact,,1
6.5,aqa_biology_foundation,,,"Suggest two reasons why a patient may choose a mechanical valve
and not a biological valve from a pig.",bio_any_n_from_approximate,,2
6.6,aqa_biology_foundation,,,Suggest one reason why a patient may choose a biological valve from a pig and not a mechanical valve.,bio_any_n_from_approximate,,1
6.7,aqa_biology_foundation,,,"A person may develop other medical conditions.
Draw one line from each medical condition to the correct treatment.",bio_draw_diagram,,2
7.1,aqa_biology_foundation,,,"The cell contains a nucleus.
What is the function of the nucleus?",bio_any_n_from_approximate,,1
7.2,aqa_biology_foundation,,,Name one type of cell that does not contain a nucleus.,bio_any_n_from_approximate,,1
7.3,aqa_biology_foundation,,,Draw a simple diagram of the cell ni Figure 12. Label two parts of the cell.,bio_any_n_from_exact,,2
7.4,aqa_biology_foundation,,,Name one structure found in a plant cell but not found in an animal cell.,bio_any_n_from_exact,,1
7.5,aqa_biology_foundation,,,The real length from point Xto point Yis 0.06 mm Calculate the magnification.,bio_calculate,,3
7.6,aqa_biology_foundation,,,"The cells shown in Figure 13 were viewed using a light microscope.
Give two advantages of using an electron microscope instead of a light microscope.",bio_any_n_from_approximate,,2
8.1,aqa_biology_foundation,,,"Mosquitoes carry a pathogen that causes malaria.
What type of pathogen causes malaria?
A: A bacterium
B: A fungus
C: A protist
D: A virus",bio_mc,,1
8.2,aqa_biology_foundation,,,Give one piece of evidence that supports the statement.,bio_any_n_from_approximate,,1
8.3,aqa_biology_foundation,,,Suggest one reason why the statement may not be valid.,bio_any_n_from_approximate,,1
8.4,aqa_biology_foundation,,,Predict the number of people per 100 000 who died from malaria ni 2017 fi the trend stayed the same.,bio_any_n_from_approximate,,1
8.5,aqa_biology_foundation,,,"Use of mosquito nets has helped to reduce the number of deaths from malaria each year.
Suggest one other reason for the reduced number of deaths from malaria each year.",bio_any_n_from_approximate,,1
8.6,aqa_biology_foundation,,,"Describe how the human body:
-prevents pathogens from entering
-defends itself against pathogens inside the body.",bio_level,,6
9.1,aqa_biology_foundation,,,This question is about photosynthesis. Complete the word equation for photosynthesis:,bio_chemical_equation,,2
9.2,aqa_biology_foundation,,,"What was the independent variable in the investigation?
A: Power output of bulb
B: Rate of photosynthesis
C: Time to collect oxygen
D: Volume of oxygen collected",bio_mc,,1
9.3,aqa_biology_foundation,,,Suggest two ways the method could be improved so the results would be more valid.,bio_any_n_from_approximate,,2
9.4,aqa_biology_foundation,,,Calculate value X in Table 9.,bio_calculate,,1
9.5,aqa_biology_foundation,,,"Complete Figure 15.
You should:
- label the x-axis
- use a suitable scale
-plot the data from Table 9 and your answer to Question 9.4
- draw a line of best fit",bio_draw_diagram,,4
9.6,aqa_biology_foundation,,,Determine the expected rate of photosynthesis with a bulb of power output 75 watts. Use Figure 15.,bio_weird,,1
9.7,aqa_biology_foundation,,,"Which graph shows the effect of temperature on the rate of photosynthesis?
A: 
B: 
C: 
D: ",bio_mc,,1