question_id,subject_id,topic_id,linked_question_id,question_text,question_type,context,total_marks
1.1,edexcel_business_studies,,,"Which one of the following could market mapping be used for?
Select one answer
A: Identifying how many customers there are in a market
B: Identifying how many employees work in a business
C: Spotting where there is a gap in the market 
D: To identify the location of a business",bs_mcq,,1
1.2,edexcel_business_studies,,,"Which one of the following is an impact of a decrease in interest rates?
Select one answer
A: Businesses will borrow less money
B: Customers will borrow less money
C: Customers will borrow more money
D: Repayments on loans should go up",bs_mcq,,1
1.3,edexcel_business_studies,,,Explain one advantage of starting a business as a private limited company.,bs_explain,,3
1.4,edexcel_business_studies,,,Explain one way the internet may affect where a small business chooses to locate.,bs_explain,,3
2.1,edexcel_business_studies,,,"Which two of the following are examples of customer needs?
Select two answers
A: Choice
B: Profit
C: Quality
D: Risk
E: Taxation",bs_mcq,,2
2.2,edexcel_business_studies,,,"Which two of the following are roles of an entrepreneur?
Select two answers
A: Going to university
B: Organising resources
C: Personal Satisfaction
D: Taking risks
E: To be a sole trader",bs_mcq,,2
2.3,edexcel_business_studies,,,"Table 1 contains information about a small business.

fixed_costs: 
        10000
variable_costs: 
        2.50 per unit
selling_price:
        5.00 per unit
break even level of output:
        4000 units

The business increases the selling price of its product to 6.50 per unit.

Using the information in Table 1, calculate the decrease in the break even level of output. You are advised to show your workings.",bs_calculate,,2
2.4,edexcel_business_studies,,,Explain one way a small business could become more competitive.,bs_explain,,3
2.5,edexcel_business_studies,,,Explain one advantage to a small business of meeting its legal obligations.,bs_explain,,3
3.1,edexcel_business_studies,,,"Which one of the following could a small business use to add value?
Select one answer
A: Locate in a convenient place
B: Pay a higher rate of taxation
C: Reduce its cash inflows
D: Use a long-term source of finance",bs_mcq,,1
3.2,edexcel_business_studies,,,"Figure 1 shows the number of units sold per month by a business from February to April. The selling price for each unit was 5.20
Using the information in Figure 1, calculate the revenue for March. You are advised to show your workings.",bs_calculate,,2
3.3,edexcel_business_studies,,,Explain one disadvantage to a small business of not paying its employees on time.,bs_explain,,3
3.4,edexcel_business_studies,,,Explain one advantage to a small business rom using retained profit as a source of finance.,bs_explain,,3
3.5,edexcel_business_studies,,,Discuss the impact on a small business from adapting existing products to develop new business ideas.,bs_discuss,,6
4.1,edexcel_business_studies,,,Outline one way that financial information in a business plan could help Lili Heating Ltd.,bs_outline,"Amelia Cooper trained as a plumber six years ago. Since then she has worked for a building company that carries out repairs to houses and business premises in the Birmingham area.
Amelia is now in a position where she wants to start her own plumbing business called Lili Heating Ltd. Even though there are many plumbers in the Birmingham area Amelia feels she has a unique selling point – she is a woman. Many female customers feel that they can relate more closely with a woman doing repairs in their homes.
As part of her business plan, Amelia has identified some clear aims and objectives and conducted a large amount of market research using the internet. Her target market requires clear advice on what work needs to be done and how much she will charge. Amelia also thinks she can cut down on advertising costs by getting her customers to recommend Lili Heating Ltd to their friends and families. For this to happen she knows that her work must be of the highest standard.
Amelia’s business plan also included a wide range of financial information to help her forecast the potential success of the business and see if she would need an overdraft.",2
4.2,edexcel_business_studies,,,Analyse the impact of non-financial aims on Amelia's decision to start Lili Heating Ltd.,bs_analyse,"Amelia Cooper trained as a plumber six years ago. Since then she has worked for a building company that carries out repairs to houses and business premises in the Birmingham area.
Amelia is now in a position where she wants to start her own plumbing business called Lili Heating Ltd. Even though there are many plumbers in the Birmingham area Amelia feels she has a unique selling point – she is a woman. Many female customers feel that they can relate more closely with a woman doing repairs in their homes.
As part of her business plan, Amelia has identified some clear aims and objectives and conducted a large amount of market research using the internet. Her target market requires clear advice on what work needs to be done and how much she will charge. Amelia also thinks she can cut down on advertising costs by getting her customers to recommend Lili Heating Ltd to their friends and families. For this to happen she knows that her work must be of the highest standard.
Amelia’s business plan also included a wide range of financial information to help her forecast the potential success of the business and see if she would need an overdraft.",6
5.1,edexcel_business_studies,,,"Table 2 shows forecasts from the business plan for month one of Lili Heating Ltd.

cash_inflows: 
        8600
cash_outflows: 
        11000
opening_balance:
        4000

Using the information in Table 2, calculate Lili Heating Ltd's forecasted closing balance at the end of month one. You are advised to show your workings.",bs_calculate,,2
5.2,edexcel_business_studies,,,"As part of her market research Amelia collected quantitative research from the Birmingham City Council website. Some of this information can be seen in Table 3.
Using the information in Table 3, calculate to 2 decimal places, the percentage of people in the age group 45-59 that are female. You are advised to show your workings.",bs_calculate,,2
5.3,edexcel_business_studies,,,Analyse the impact on Lili Heating Ltd of using the internet to collect secondary market research.,bs_analyse,"Amelia Cooper trained as a plumber six years ago. Since then she has worked for a building company that carries out repairs to houses and business premises in the Birmingham area.
Amelia is now in a position where she wants to start her own plumbing business called Lili Heating Ltd. Even though there are many plumbers in the Birmingham area Amelia feels she has a unique selling point – she is a woman. Many female customers feel that they can relate more closely with a woman doing repairs in their homes.
As part of her business plan, Amelia has identified some clear aims and objectives and conducted a large amount of market research using the internet. Her target market requires clear advice on what work needs to be done and how much she will charge. Amelia also thinks she can cut down on advertising costs by getting her customers to recommend Lili Heating Ltd to their friends and families. For this to happen she knows that her work must be of the highest standard.
Amelia’s business plan also included a wide range of financial information to help her forecast the potential success of the business and see if she would need an overdraft.",6
6.1,edexcel_business_studies,,,"State one element of the marketing mix, other than price, for Lili Heating Ltd.",bs_state,"Amelia Cooper trained as a plumber six years ago. Since then she has worked for a building company that carries out repairs to houses and business premises in the Birmingham area. Amelia is now in a position where she wants to start her own plumbing business called Lili Heating Ltd. Even though there are many plumbers in the Birmingham area Amelia feels she has a unique selling point – she is a woman. Many female customers feel that they can relate more closely with a woman doing repairs in their homes. As part of her business plan, Amelia has identified some clear aims and objectives and conducted a large amount of market research using the internet. Her target market requires clear advice on what work needs to be done and how much she will charge. Amelia also thinks she can cut down on advertising costs by getting her customers to recommend Lili Heating Ltd to their friends and families. For this to happen she knows that her work must be of the highest standard. Amelia’s business plan also included a wide range of financial information to help her forecast the potential success of the business and see if she would need an overdraft.",1
6.2,edexcel_business_studies,,,Outline one reason why the government would want Lili Heating Ltd to be successful.,bs_outline,"Amelia Cooper trained as a plumber six years ago. Since then she has worked for a building company that carries out repairs to houses and business premises in the Birmingham area.
Amelia is now in a position where she wants to start her own plumbing business called Lili Heating Ltd. Even though there are many plumbers in the Birmingham area Amelia feels she has a unique selling point – she is a woman. Many female customers feel that they can relate more closely with a woman doing repairs in their homes.
As part of her business plan, Amelia has identified some clear aims and objectives and conducted a large amount of market research using the internet. Her target market requires clear advice on what work needs to be done and how much she will charge. Amelia also thinks she can cut down on advertising costs by getting her customers to recommend Lili Heating Ltd to their friends and families. For this to happen she knows that her work must be of the highest standard.
Amelia’s business plan also included a wide range of financial information to help her forecast the potential success of the business and see if she would need an overdraft.",2
6.3,edexcel_business_studies,,,Justify which one of these two options Lili Heating Ltd should choose.,bs_justify,"Amelia Cooper trained as a plumber six years ago. Since then she has worked for a building company that carries out repairs to houses and business premises in the Birmingham area.
Amelia is now in a position where she wants to start her own plumbing business called Lili Heating Ltd. Even though there are many plumbers in the Birmingham area Amelia feels she has a unique selling point – she is a woman. Many female customers feel that they can relate more closely with a woman doing repairs in their homes.
As part of her business plan, Amelia has identified some clear aims and objectives and conducted a large amount of market research using the internet. Her target market requires clear advice on what work needs to be done and how much she will charge. Amelia also thinks she can cut down on advertising costs by getting her customers to recommend Lili Heating Ltd to their friends and families. For this to happen she knows that her work must be of the highest standard.
Amelia’s business plan also included a wide range of financial information to help her forecast the potential success of the business and see if she would need an overdraft.",9
7.1,edexcel_business_studies,,,State one example of a risk for an investor in Ripple.,bs_state,"Ripple is an energy company aimed at providing green and renewable energy to homes and businesses across the UK. It is the country’s first consumer-owned wind farm, generating green energy that does not have a damaging effect on the environment. Instead of customers paying Ripple to supply them with energy they become members of the business and buy a part of a wind farm located in a remote area of South Wales. Customers are then supplied with energy to their homes based on the amount of money they invested. The amount of money that customers can invest varies on their energy needs, but Ripple claims that it can supply energy cheaper than its competitors. The process of becoming a member is very simple. Firstly, Ripple will ask customers a few questions to identify their energy needs. It will then create a green energy plan to establish how much each customer should invest into the wind farm. Ripple manages the wind farm and provides energy to each customer’s home or business. Ripple’s business plan fits in with the UK government’s cleaner energy strategy. This strategy includes plans for the country to have net zero carbon emissions by 2050 and to create 220,000 new jobs in the green energy sector of the economy.",1
7.2,edexcel_business_studies,,,"Using the information in Table 4, identify which type of energy use declined the most between 2018 and 2019.",bs_identify,,1
7.3,edexcel_business_studies,,,Outline one benefit to customers from Ripple asking questions to identify its customer needs.,bs_outline,"Ripple is an energy company aimed at providing green and renewable energy to homes and businesses across the UK. It is the country’s first consumer-owned wind farm, generating green energy that does not have a damaging effect on the environment. Instead of customers paying Ripple to supply them with energy they become members of the business and buy a part of a wind farm located in a remote area of South Wales. Customers are then supplied with energy to their homes based on the amount of money they invested. The amount of money that customers can invest varies on their energy needs, but Ripple claims that it can supply energy cheaper than its competitors. The process of becoming a member is very simple. Firstly, Ripple will ask customers a few questions to identify their energy needs. It will then create a green energy plan to establish how much each customer should invest into the wind farm. Ripple manages the wind farm and provides energy to each customer’s home or business. Ripple’s business plan fits in with the UK government’s cleaner energy strategy. This strategy includes plans for the country to have net zero carbon emissions by 2050 and to create 220,000 new jobs in the green energy sector of the economy.",2
7.4,edexcel_business_studies,,,Justify which one of these two options would have the most significant impact on the success of Ripple.,bs_justify,"Ripple is an energy company aimed at providing green and renewable energy to homes and businesses across the UK. It is the country’s first consumer-owned wind farm, generating green energy that does not have a damaging effect on the environment. Instead of customers paying Ripple to supply them with energy they become members of the business and buy a part of a wind farm located in a remote area of South Wales. Customers are then supplied with energy to their homes based on the amount of money they invested. The amount of money that customers can invest varies on their energy needs, but Ripple claims that it can supply energy cheaper than its competitors. The process of becoming a member is very simple. Firstly, Ripple will ask customers a few questions to identify their energy needs. It will then create a green energy plan to establish how much each customer should invest into the wind farm. Ripple manages the wind farm and provides energy to each customer’s home or business. Ripple’s business plan fits in with the UK government’s cleaner energy strategy. This strategy includes plans for the country to have net zero carbon emissions by 2050 and to create 220,000 new jobs in the green energy sector of the economy.",9
7.5,edexcel_business_studies,,,Evaluate the importance of price in Ripple's marketing mix. You should use the information provided as well as your knowledge of business.,bs_evaluate,"Ripple is an energy company aimed at providing green and renewable energy to homes and businesses across the UK. It is the country’s first consumer-owned wind farm, generating green energy that does not have a damaging effect on the environment. Instead of customers paying Ripple to supply them with energy they become members of the business and buy a part of a wind farm located in a remote area of South Wales. Customers are then supplied with energy to their homes based on the amount of money they invested. The amount of money that customers can invest varies on their energy needs, but Ripple claims that it can supply energy cheaper than its competitors. The process of becoming a member is very simple. Firstly, Ripple will ask customers a few questions to identify their energy needs. It will then create a green energy plan to establish how much each customer should invest into the wind farm. Ripple manages the wind farm and provides energy to each customer’s home or business. Ripple’s business plan fits in with the UK government’s cleaner energy strategy. This strategy includes plans for the country to have net zero carbon emissions by 2050 and to create 220,000 new jobs in the green energy sector of the economy.",12
1,aqa_history,,,Source A is critical of the Bolsheviks during the First World War. How do you know? Explain your answer using Source A and your contextual knowledge.,hs_explain,"Source A:  A British cartoon entitled ‘Betrayed’, published in December 1917. The figure in
the doorway is the German Kaiser.",4
2,aqa_history,,,How useful are Sources B and C to an historian studying military technology and tactics in the First World War? Explain your answer using Sources B and C and your contextual knowledge.,hs_explain,"Source B A picture published in a British newspaper in October 1917. It shows readers
how British soldiers advance under an artillery barrage.

Source C: Adapted from the book ‘Tank Warfare: the Story of the Tank in the Great War’ by
Frank Mitchell, published after the war.
Mitchell was a tank commander in the First World War and describes part of a
tank battle which took place during the German Spring Offensive in
April 1918. Mitchell was awarded a medal for bravery in this battle.

```
We were stuck and German soldiers were preparing to attack my tank. But
then on my right I saw seven of our newest and fastest tanks, ‘Whippets’,
racing into action.
Firing their machine guns, they drove straight into the German soldiers, and
scattered them in all directions. They quickly destroyed the German threat.
```",12
3,aqa_history,,,Write an account of how the Schlieffen Plan led to problems in 1914.,hs_analyse,,8
4.1,aqa_history,,,The Alliance System was the main cause of the First World War.' How far do you agree with this statement? Explain your answer.,hs_judgement,,16
4.2,aqa_history,,,The Alliance System was the main cause of the First World War.' How far do you agree with this statement? Explain your answer.,hs_spag,,4
1.1,aqa_biology_foundation,,,"
Which food contains the highest percentage of carbohydrate? Tick  one box.
A: Beans
B: Chicken
C: Orange
D: Rice",bio_mc,,1
1.2,aqa_biology_foundation,,,Estimate the percentage of water found in beans.,bio_any_n_from_exact,,1
1.3,aqa_biology_foundation,,,"Look at Figure .1
Why would eating only beans provide a more balanced diet than eating only chicken?",bio_any_n_from_approximate,,1
1.4,aqa_biology_foundation,,,"Sugars are produced when enzymes break down starch.
What is the name of the enzyme which breaks down strach to produce sugar?
A: Amylase
B: Bile
C: Lipase
D: Protease",bio_mc,,1
1.5,aqa_biology_foundation,,,"Which chemical could be used to test for glucose?
A: Benedict's reagent
B: Biuret reagent
C: lodine solution
D: Sulfuric acid",bio_mc,,1
1.6,aqa_biology_foundation,,,What colour change would be seen in a positive test for glucose?,bio_any_n_from_exact,,1
1.7,aqa_biology_foundation,,,"Which person has severe diabetes?
A:A
B:B
C:C
D:D",bio_mc,,1
1.8,aqa_biology_foundation,,,Glucose is absorbed into the bloodstream in part X. Name part X.,bio_any_n_from_exact,,1
1.9,aqa_biology_foundation,,,"Some glucose is absorbed into the bloodstream against the concentration gradient by the process of ____
Water moves out of part Yand into the bloodstream by the process of ____",bio_any_n_from_exact,,2
2.1,aqa_biology_foundation,,,"What is diffusion?
A: The movement of particles from a high concentration to a low concentration
B: The movement of particles from a low concentration ot a high concentration
C: The movement of water from a concentrated solution to a more dilute solution",bio_mc,,1
2.2,aqa_biology_foundation,,,"Describe how one feature of the axolotl's gills increases the rate of diffusion of oxygen.
Use information from Figure 3.",bio_any_n_from_approximate,,2
2.3,aqa_biology_foundation,,,"When stem cells specialise to produce gil cells, this process is known as",bio_any_n_from_exact,,1
2.4,aqa_biology_foundation,,,"Complete the sentence. Choose from the box.
To grow a new gill the stem cells divide by ___",bio_fill_in_the_blank,,1
2.5,aqa_biology_foundation,,,"Which one of the following does not contain stem cells?
A: Bone Marrow
B: Embryos
C: Hair
D: Meristem tissue",bio_mc,,1
2.6,aqa_biology_foundation,,,"Axolotis are small animals.
Axolotis are used in stem cell research. What are two advantages of using axolotls ni stem cel research?
A: Axolotls are cheap to feed
B: Axolotls are easy to breed
C: Axolotls are endangered
D: Axolotls live in water
E: Acolotl research is cruel",bio_mc,,2
2.7,aqa_biology_foundation,,,"Where does oxygen enter the bloodstream?
A: A
B: B
C: C
D: D",bio_mc,,1
2.8,aqa_biology_foundation,,,Name part E on Figure 4.,bio_any_n_from_exact,,1
2.9,aqa_biology_foundation,,,"Which blood vessel carries blood ot the lungs?
A: Aorta
B: Pulmonary artery
C: Vena cava",bio_mc,,1
3.1,aqa_biology_foundation,,,"The layer of cells lining the upper surface and lower surface of a leaf is the ___
The part of the leaf where most photosynthesis occurs is the ___
Water is transported to the leaf in the ___",bio_fill_in_blank,,3
3.2,aqa_biology_foundation,,,"The cells labelled Xcontrol the width of the stomata. What are the cells labelled X?

A: Guard Cells
B: Mesophyll Cells
C: Root hair cells
D: stem cells",bio_mc,,1
3.3,aqa_biology_foundation,,,"What is the function of the stomata?
A: To alow light into the leaf
B: To let carbon dioxide into the leaf
C: To let sugars out of the leaf
D: To protect the leaf from pathogens",bio_mc,,1
3.4,aqa_biology_foundation,,,"
How is water lost from a leaf?
A: By evaporation
B: By respiration
C: by translocation",bio_mc,,1
3.5,aqa_biology_foundation,,,"Calculate the difference ni the volume of water lost by plant Acompared to plant Bni the first hour.
",bio_any_n_from_approximate,,2
3.6,aqa_biology_foundation,,,"What could cause plant A to lose water at a faster rate than plant B?
A: Plant A has fewer stomata per leaf.
B: Plant A is smaller.
C: Plant A has more leaves.
D: Plant A has smaller leaves.",bio_mc,,1
3.7,aqa_biology_foundation,,,"
After the first 2 hours, both plants were moved ot a new room.
Suggest one reason why both plants lost water at a faster rate ni the new room.",bio_any_n_from_exact,,1
3.8,aqa_biology_foundation,,,Describe one way the holly plant is adapted to stop it being eaten by animals.,bio_any_n_from_exact,,1
4.1,aqa_biology_foundation,,,"Which two variables did the student control in the method?
A: Mass of sugar
B: pH of the mixture
C: Temperature
D: Volume of foam
E: Volume of yeast and water",bio_mc,,2
4.2,aqa_biology_foundation,,,"
What is value X in Table 3? Use Figure 8.",bio_any_n_from_exact,,1
4.3,aqa_biology_foundation,,,"Which gas causes the foam to rise?
A: Carbon dioxide
B: Hydrogen
C: Nitrogen
D: Oxygen",bio_mc,,1
4.4,aqa_biology_foundation,,,What conclusion can you make about the relationship between the mass of sugar used and the volume of gas produced?,bio_any_n_from_approximate,,1
4.5,aqa_biology_foundation,,,Why was no foam produced in the mixture with 0 g of sugar?,bio_any_n_from_approximate,,1
4.6,aqa_biology_foundation,,,Why was the measuring cylinder with 0 g of sugar included in the investigation?,bio_any_n_from_approximate,,1
4.7,aqa_biology_foundation,,,The top of the mixture can be covered with a layer of oil after step 3 in the method. Suggest why the layer of oil stops the yeast respiring aerobically,bio_any_n_from_approximate,,1
4.8,aqa_biology_foundation,,,"What other substance is produced during anaerobic respiration in yeast?
A: Ethanol
B: Hydrochloric acid
C: Lactic acid
D: Water",bio_mc,,1
5.1,aqa_biology_foundation,,,"The man has a bacterial infection.
What is the most likely cause of the man's symptoms?
A: Gonorrhoea
B: HIV
C: Measles
D: Salmonella poisoning",bio_mc,,1
5.2,aqa_biology_foundation,,,"The man took a ful course of antibiotics.
The man's symptoms did not improve.
Why did the antibiotics not cure the symptoms?
A: The bacteria are immune to the antibiotics.
B: The bacteria are resistant to the antibiotics.
C: The man is immune to the antibiotics.
D: The man is resistant to the antibiotics.",bio_mc,,1
5.3,aqa_biology_foundation,,,"Using a condom can stop the bacteria being passed to another person during sexual intercourse.
Suggest a different way the man could avoid passing the bacteria on to someone else.",bio_any_n_from_approximate,,1
5.4,aqa_biology_foundation,,,"Compare the effectiveness of the three antibiotics at killing the different types
of bacteria.",bio_level,,6
5.5,aqa_biology_foundation,,,"
Which milk sample is shown in Figure 10?
A: Sample E
B: Sample F
C: Sample G
D: Samples H",bio_mc,,1
5.6,aqa_biology_foundation,,,Calculate the mean number of bacteria in the four samples in Table 4.,bio_calculate,,2
